{
  "contract_version": 1,
  "profile": "inline-http",
  "executor_profile": "inline-enforcer",
  "transport": "openapi-http",
  "input_contract_digest": "sha256:00e24681f0f7d187a77708c4d846256db4f3f9930bc8123d8d3b6220a9eed4f7",
  "output_contract_digest": "sha256:00e24681f0f7d187a77708c4d846256db4f3f9930bc8123d8d3b6220a9eed4f7",
  "readiness_contract_digest": "sha256:00e24681f0f7d187a77708c4d846256db4f3f9930bc8123d8d3b6220a9eed4f7",
  "reset_contract_digest": "sha256:00e24681f0f7d187a77708c4d846256db4f3f9930bc8123d8d3b6220a9eed4f7",
  "timeout_ms": 200000,
  "failure_outcome": "invalid-defense-error"
}
